categoria,pregunta,respuesta
General,¿Qué es este sitio?,"Es el hub del Management Team para acompañar el proyecto final (Target Analyzer): preguntas frecuentes, links y contacto del equipo."
General,¿Para quién es?,Principalmente para los alumnos de las 4 comisiones de Desarrollo Web Full Stack.
Grupos,¿A quién le escribo si mi grupo tiene una duda?,Al Management Team. Somos el enlace con el profe Estayno y estamos para guiarte.
Entregas,Pregunta de ejemplo sobre entregas,"Respuesta de ejemplo con una coma adentro, para probar que el parser la maneja bien."
Soporte,¿Cómo contacto al Management Team?,Escribinos a cualquiera de los mails que están al pie de la página.
